physName,comment,commentDate,ratingStaff,ratingPunctuality,ratingHelpfulness,ratingKnowledge
Dr. Robert Fingerote,"Dr. Fingerote was an absolute lifesaver! In a hospital full of people who were inaccessible and didn't give a****, Dr. Fingerote was an absolute ray of sunshine. He talked with us, listened to our problems, and came up with solutions that took our wishes into consideration. Doctors like this remind us that health care in Canada can really be efficient and effective. Thanks again, Dr. Fingerote.","May 15, 2011",3,5,5,5
Dr. Robert Fingerote,"Robert , is professional to the inth degree,he tells I like it is and you never need to waste valuable energy on questioning what might be. Robert is compassionate and scales himself, which is certainly and indicator of someone who sincerely cares about the well being of his patients. I quite appreciated his frankness with me. God Bless","March 25, 2011",5,5,5,5
Dr. Robert Fingerote,"Dr. Robert Fingerote he is the best doctor ever, he saved my life.","March 4, 2011",5,5,5,5
Dr. Robert Fingerote,Procedure results are not reported back to patient. Difficult to contact on the phone or returning phone calls,"February 24, 2011",2,3,3,5
Dr. Robert Fingerote,"Amazing, very helpful, knowledgable, and you feel that he really does care about you and your health. I would rec. him to anyone, anytime.","January 3, 2011",5,5,5,5
Dr. Robert Fingerote,"Dr Fingerote has been the best doctor so far in my experience with doctors in Canada. He saw me at emergency and was such a breath of Fresh air, after all the rude attitude and treatment i had received from other doctors and nurses at York central hospital. He is the sweetest and most calm doctor, very knowledgeable, and best of all, gave me a free consultation service- knowing i had just migrated and did not yet have OHIP coverage. He was a real angel in that sense. He treated me with so much respect that it made up for the times that he was even late in seeing me. It was always worth the wait to see him because he made me feel comfortable and better. My husband flew in on time to witness his kind heart and we were all just in awe of his gentle spirit. We need more doctors like you Dr. Fingerote! I pray your family benefit from your good and kind heart. Highly recommended!!No Joke!! He is the BEST!","December 7, 2010",5,5,5,5
Dr. Robert Fingerote,Very compasionate and caring. Knows his field very well. Easy to understand.,"November 30, 2010",5,5,5,5
Dr. Robert Fingerote,"I was referred to Dr Fingerote when I had gastroenterology issues. I was very impressed by his caring demeaner and the thoroughness with which he explained my ailment, the various treatment options open to me and his own recommendations for my particular case. He was also the recommended gastro specialist referred to my invalid mother. If he feels a particular treatment would not be in a patient's best interest he will advise against it but always makes sure that you fully understand that ultimately that the treatment you opt for is your personal choice given all the facts. He is very thorough and will both tell you and show you what the true situation is. No sugar coating... he tells it like it is. He is very thoughtful and caring about his patients, always calm and gentle from what I have seen. I would recommend him to anyone... anytime! If you ever need a gastro-intestinal specialist you would find it difficult to top him in your search for the right doctor to consult.","June 15, 2010",5,5,5,5
Dr. Robert Fingerote,"This is a wonderful doctor. I have never had a doctor who really listened to me as he did, and explained things to me so well. I have been from doctor to doctor and he is the only one who has helped me. He is really a special caring doctor.","February 17, 2010",5,5,5,5
Dr. Robert Fingerote,"I found him very knowledgable and straight forward, no sugar coating. I appreciated his in my face attitude to give me a wake up call. We need more doctors like this.","February 17, 2010",5,5,5,5
Dr. Robert Fingerote,"Excellent doctor. Would visit again. Good communication, direct, yet sincere.","February 9, 2010",5,5,5,5
Dr. Shane Hadlock,Worst dr ever told me everything was fine ya got second opinion turns out I have 4 diseases,"August 29, 2017",5,3,1,1
Dr. Shane Hadlock,Dr. Hadlock seem to be in a hurry the two time I saw him. Even for my procedure I felt rush. The anesthesiologist add to tell him to wait for me to be fully sedated after I told him that I was not comfortable with him starting the procedure right away. I was the one who have been waiting one hour an a half past my booked appointment time. I did not need to be rush on top of that for him to catch up on his schedule. I felt rush again when he gave me my result. I just wish that he would take less patients and slow down a bit and be on time for his patients. In a long term it would probably serve him as well since.,"June 13, 2017",5,1,2,3
Dr. Shane Hadlock,"His staff does not care. I was in the office trying to book for a test and the receptionist took 4 calls while talking to me. She should have asked them to hold but she took each call.
The day of the test I had to fast until my afternoon appointment. It was hard but what was very frustrating is that the Dr. was an hour and a half late. I find that very irresponsible.","March 20, 2017",1,1,3,3
Dr. Shane Hadlock,Great Dr. Takes time to explain thoroughly. Good sense of humour. Overall great experience. Wish more were like him.,"October 7, 2016",5,5,5,5
Dr. Shane Hadlock,Overall is good but a lot of wait even on scheduled appointment.,"July 28, 2016",4,1,4,4
Dr. Shane Hadlock,"Dr. Hadlock recently conducted a colonoscopy on me and I was very impressed by his thoroughness, professionalism and caring approach. I have had colonoscopys by two other doctors however Dr. Hadlock was by far the best. If you need a gastroenterologist, Dr. Hadlock is the one you want. Pat T","January 9, 2015",5,5,5,5
Dr. Shane Hadlock,Dr. Hadlock is an excellent gastroenterologist who cares for his patients.,"October 14, 2014",5,5,5,5
Dr. Shane Hadlock,"I am happy that I was referred to Dr. Hadlock for specialized treatment. He is a thorough professional with caring approach. He did go out of his way to treat me. His administrative assistant, Sandy, is equally caring and compassionate. Thank you both.","October 3, 2014",5,4,5,5
Dr. Shane Hadlock,Very good specialist. Friendly staff. Very knowlegeable physician who took his time to explain procedure and colonoscopy done with expertise.,"September 30, 2014",5,5,5,5
Dr. Shane Hadlock,"Dr Hadlock is a very good Dr, I had to have minor surgery 6 days after my colonoscopy, and Dr Hadlock took time off on his day off to meet me in his office then the hospital where he explain clearly what had to be done and fixed everything the next day. His secretary Sandy is always so helpfull and pleasant and Dr Hadlock has excellent and fantastic bedside manners that made my stay in the hospital so re-assuring and pleasant. Thank you Pauline","September 20, 2014",5,5,5,5
Dr. Shane Hadlock,"Dr. hadlock is great MD with pleasant manner and a great deal of knowledge; however his office is not the most punctual, with frequent delays in appointment time up to one hour late.","August 20, 2014",4,2,4,5
Dr. Shane Hadlock,This doctor is great and the receptionist is very nice! I highly recommend this doctor's office. It was quite refreshing to not have to deal with a rushed doctor and his cranky staff.,"August 1, 2014",5,5,5,5
Dr. Shane Hadlock,"Dr. Hadlock Excellent doctor and staff, very thorough, explains things, answers question clearly and fantastic bed side manners.","July 10, 2014",5,5,5,5
Dr. Shane Hadlock,"Dr. headlock saved my life when diagnosing a very rare tumour in my small intestine during a routine colonoscopy. Less than 1 percent of the population will be diagnosed with a Carcenoid tumour and that was what Dr. Hadlock found in April 2014. He knowledge and quest to go the extra mile so the speak propelled him to scope my colon those extra 2 inches into the ileum wherein not many Gastro do so would be so thorough. It was in this last 2 inches of the procedure he noticed a white patch of skin amid extremely healthy pink tissue. He scoped it and sent it away for pathology...sure enough it was a Carcenoid Tumour but small and encapsulated. I shudder to think about what would have happened if he had not been so ""picky"" and those are the words he used to describe himself. Well I am cancer free today as a result of Dr. Hadlock's expertise and thoroughness! It was caught very early, removed by a great surgeon! Cheryl Turpin","July 6, 2014",5,5,5,5
Dr. Shane Hadlock,"Dr. Hadlock is very knowledgeable, explains his findings so that a layman understands and shows that he sincerely cares about his patients. I knew I was in good hands under his care.","May 9, 2014",5,5,5,5
Dr. Shane Hadlock,"His secretary and Dr. Hadlock are wonderful. Very kind, warm and helpful. Outstanding medical service. Very pleased and happy with the medical care I have gotten from both of them.","December 4, 2012",5,4,5,5
"Dr. L.A. Lietaer, Retired",One of the best doctors ever - a shame he is retired now (not a shame for him but for us).,"November 30, 2013",5,5,5,5
"Dr. L.A. Lietaer, Retired","Amazing Dr. Highly recommend. His bedside manners are amazing and he really knows how to calm a patient. I soo wish that he was a family Dr, he would be the best. I have nothing but positive things to say and he has a great sense of humour","February 4, 2009",5,5,5,5
"Dr. L.A. Lietaer, Retired","I have been seeing Dr. Lietaer for 18 years as I have Crohn's disease. I was sick for over a year before I was finally sent to him and he diagnosed me within a week. I was sick for several years, had surgery, admissions to hospital and he always makes me feel comfortable and at ease. He would call me at home to see how I was doing and I could call him anytime and he would get back to me promptly. He is a wonderful person and a great doctor. Jill Thompson","January 22, 2009",5,5,5,5
"Dr. L.A. Lietaer, Retired","Dr. Lietaer is a great doctor with excellent skills, and a good person who cares about patients.","January 7, 2009",5,5,5,5
"Dr. L.A. Lietaer, Retired","Dr. Lietaer has attended upon this humble writer for several years following his thorough examinations and subsequent diagnosis of Crohn's Disease in this host. Dr. Lietaer presents a consistent and professional demeanor at all times, with a glowing and infectious cheer that opens all the doors welcoming you in to his office and at odd times with his arm around your shoulder as if at the reuniting of two old friends. Nothing puts me more at ease than to know that the pain and disease that is now and forever part of my life is being treated with the utmost of his abilities and care as if that pain where his own. Finally, in my own teaching and in my own learning, I have found that any unadulturated expression of gratitude transends this veil of tears and arrives softly to God's own ear. Hopefully, this will too. Nuff said...","February 5, 2008",5,5,5,5
"Dr. L.A. Lietaer, Retired","After a couple of years and several misdiagnosis by other colleauges, he found the actual issue and is helping me through it.","July 28, 2007",5,5,5,5
"Dr. L.A. Lietaer, Retired","All doctors should have to intern with him for at least two years. All professionals should have his bedside manner and interest in each and every patient he sees. He is the most gentle, caring, and friendliest doctor I have met. Wonderful Doctor !","June 4, 2007","Staff
5
Punctuality
5
Helpfulness
5
Knowledge",5,5,5
"Dr. L.A. Lietaer, Retired","Dr. Lietaer is truly wonderful...first class physician who makes you feel comfortable and always takes time to listen if you're having problems. I love his sense of humour, too...especially during a colonoscopy!","May 7, 2007","Staff
4
Punctuality
5
Helpfulness
5
Knowledge",4,5,5
"Dr. L.A. Lietaer, Retired","I,ve been seeing this Dr. for over 3 yrs. Never once have I been disappointed with his demeaner or attitude. If he is not able to solve your problem because its not part of his field, he takes the time and trouble to find a Dr. who can and will set up an appointment for you. He has personnley taken the time to phone me at home reporting on test resaults. Absolutly the best.","April 5, 2007","Staff
5
Punctuality
5
Helpfulness
5
Knowledge",5,5,5
"Dr. L.A. Lietaer, Retired","great doctor, wonderful sense of humour. Puts me at ease right away and can talk to him about anything.","March 25, 2007","Staff
5
Punctuality
5
Helpfulness
5
Knowledge",5,5,5
"Dr. L.A. Lietaer, Retired",Very efficient. Top rated Dr. as far as I'm concerned.Takes all the time you need does not push you out. He makes sure you know everything there is to know.,"March 14, 2007","Staff
5
Punctuality
5
Helpfulness
5
Knowledge",5,5,5
"Dr. L.A. Lietaer, Retired","Very Helpful, and will take the time to listen, and explain about a problem, as well as ask relevant questions.","March 10, 2007","Staff
4
Punctuality
5
Helpfulness
5
Knowledge",4,5,5
Dr. Gordon Bierbrier,"He is an amazing and kind DR. that I have been seeing for many years now. I just wish I had seen him years ago. And if he doesn't know, or is suspicious of something, he will send you to another colleague.","May 30, 2017",5,5,5,5
Dr. Gordon Bierbrier,Excellent doctor. Was very friendly and informative. Mind was at eased after the visit. Receptionist was also very friendly.,"May 11, 2017",5,5,5,5
Dr. Gordon Bierbrier,"He is a wonderful doctor. He was kind and professional. He made me feel comfortable in a situation that could definitely be awkward. The female nurse prepped me for the procedure and I was happy to be ""sleeping"" before the procedure started. When I woke up, it was all over and Dr. B reassured me that everything was done and looked fine. I would highly highly recommend him for anyone who needs to get a colonoscopy done. It was as good as it could've ever been.","February 2, 2017",5,5,5,5
Dr. Gordon Bierbrier,"46 yrs old and I am very happy with him as my Dr. I have been seeing him since I moved to Canada from the US and he is thorough and listens to the issue at hand. I have had to do colonoscopies due to my family history of colon/rectal cancer and I'd say that he is a Very good Dr. I am an avid advocate of taking your health seriously and in your own hands. And I do!this is why I choose Dr. B.
He does not take any chances. Bravo!!!!!! 
Not the biggest fan of the hospital affiliation - but I will need to go where he goes.","July 7, 2016",4,4,4,5
Dr. Gordon Bierbrier,"I've known Dr Bierbrier for almost 3 years now, and I have nothing but praises for him! Everybody who truly knows him would agree that he is a great doctor with a good heart. He is very thorough, really takes time to listen. He is brilliant, totally knows what he's doing. He is very honest. He will tell you what you need to do and not what you wanted to hear! Truly, a wondeful doctor! His good personality is a bonus.","June 10, 2016",5,5,5,5
Dr. Gordon Bierbrier,Dr. Bierbrier is a truly wonderful Doctor with a sense of humor too!! I have been seeing Dr. B for a few years and I cannot begin to express how much he has helped me. I feel very lucky to have him as my Doctor. He actually listens! Thanks Dr. B,"June 5, 2015",5,5,5,5
Dr. Gordon Bierbrier,Dr. Bierbrier is amazing. He is absolutely the best at what he does and his compassion knows no boundaries. There are not enough words to express what a great experience it was to have him look out for my mother and I. Thank you so much for doing what you do!!!!,"November 13, 2014",5,5,5,5
Dr. Gordon Bierbrier,"Dr. Bierbrier is a great doctor! I wouldn't ask for another doctor, he cares about his patients I've been going to him for the past 5 years for Crohns. I couldn't care for the secretary he had she was rude ALL the time big attitude that lady had! There is a new one there now and she is so nice and pleasant to the patients! Great doctor and great staff A+","Submitted April 23, 2014",5,5,5,5
Dr. Gordon Bierbrier,"I went to see Dr. Bierbrier in the fall of 2010 to have a colonoscopy after having rectal bleeding for 4 months & developing urgency with bowel movements. After an initial consult, (no examination was even done) he concluded that I just had a bad case of hemorrhoids - I had a 4 month old and I was otherwise in very good health. Well as it turns out, a year and a half later I was diagnosed Ulcerative Colitis affecting a large portion of my colon which I suffered with again for months (trying to treat as hemorrhoids...) Maybe he should have actually done the scope!","October 20, 2013",3,3,1,2
Dr. Gordon Bierbrier,Fantastic doctor. I would recommend going to see him if you have any gastro related issues. Very funny and kind. Cares about each one of his patients and takes the time to listen to you and your concerns.,"October 16, 2013",5,5,5,5
Dr. Gordon Bierbrier,Awesome doctor! Always thinking of the patients best interest and has a great sense of humor. Glad to have him as a doctor.,"July 30, 2013",4,4,5,5
Dr. Gordon Bierbrier,"Dr.Bierbrier is honest, direct and truly cares about patients. He speaks to you, not at you, and listens to what you have to say.","May 28, 2013",4,5,5,5
Dr. Gordon Bierbrier,"Still seeing Dr. B. He is very helpful, cares about his patients and finds humor when things don't look so great in my eyes. His skills, knowledge, personality has made coping with my illness easier.","November 8, 2012",3,5,5,5
Dr. Gordon Bierbrier,very good dr had scope for ruptured artery have made another app for checkup and tests,"August 11, 2012",3,3,5,5
Dr. Gordon Bierbrier,"expect very low interest from the secretary who seems more interested in her snacks than answering phone or being pleasant to the waiting patients. Do not complain, else you may get her very upset & get a silent treatment. The doctor makes up with his pleasand demeanor for his secretary, that is IF she ever get to scheduling an appointment for you and advises your family doctor, but do not hold your breath.","June 26, 2012",1,3,5,5
Dr. Gordon Bierbrier,"Dr Bierbrier is a great dr. He listens well to your concerns, and tries to address them to the best of his knowledge. The secretary, is very nice. You have a very short wait time to see the dr. I recommend anyone to see this dr.","May 22, 2012",5,4,4,5
Dr. Gordon Bierbrier,"Great doctor and listens well and answers all of your concerns and questions, only problem i have is the secretary(not nice, attitude etc) but Bierbrier is a great G.I Doctor","April 30, 2012",1,5,4,4
Dr. Gordon Bierbrier,"He saw me 15 minutes and didn't order one test and didn't complete a full assessment; only relied on previous tests done many months and even years earlier. He said my symptoms were nothing of concern [although distressing to me e.g. weakness, unrelenting fatigue, exercise intolerance, night sweats, pain, lumps, etc.] and said no reason to order further tests stating I should try an antidepressant instead. He then send a ""very lengthy report"" as per my FP. How can he diagnose me as being depressed and have such a lengthy report after seeing me only 15 minutes and when I denied any feelings/symptoms of depression??? Totally demoralizing to be so misunderstood and unheard!","February 24, 2012",3,2,1,2
Dr. Keith Bovell,Excellent doctor in every way. Brilliant and friendly.,"September 28, 2017",5,5,5,5
Dr. Keith Bovell,Very knowledgeable and care... straight to the point! Wonderful staff and very friendly!,"August 5, 2017",5,4,5,5
Dr. Keith Bovell,"Dr. Bovell and his staff are hardworking, patient and knowledgeable. It's a busy office and they do an excellent job! Keep up the great work everyone!","May 25, 2017",5,5,5,5
Dr. Keith Bovell,"Dr. Bovell is the most caring, compassionate doctor I have ever had. He is very knowledgeable and explains everything so you can understand it. It is always a wait to see him as he is very busy but certainly worth the wait. He takes time to really listen to your problems and makes you feel like you matter. He has been my doctor for over 20 yrs and I don't know what I would do without him. He is literally a lifesaver. Thanks so much for being there Dr. Bovell.","May 8, 2017",5,3,5,5
Dr. Keith Bovell,"A very busy office, with great staff. Dr. Bovell is kind and patient and takes his time to listen to my concersn, a long wait to get to see him; but totally worth the wait.","February 23, 2017",5,4,5,5
Dr. Keith Bovell,Can't say enough good things about my experience with Dr. Bovell. He was very attentive and explained everything thoroughly. He has such a wonderful and caring manner and a great sense of humour. He answered all of my questions and put me at ease. His office staff were just lovely and informative. I arrived 10 minutes early for paperwork and was in to see Dr. Bovell on time. No wait at all. I have heard wonderful things about him and am so grateful hemail will be taking care of me.,"December 9, 2016",5,5,5,5
Dr. Keith Bovell,"Dr. Bovell is extremely passionate about his work. He went above and beyond with me and my IBD and continues to do so. I will be forever grateful to have him as my gastroenterologist; the man literally saved my life when I was at my worst. Know that if you ever find yourself his patient that you are in the best possible hands. Also, his reception staff work by the same standard, above and beyond despite the busy workload!","November 29, 2016",5,5,5,5
Dr. Keith Bovell,Very helpful and pleasant. Staff is quite helpful and busy. Got me in as quickly as possible and got test done right away for my condition and got it under control.,"September 20, 2016",5,4,5,5
Dr. Keith Bovell,"Excellent physician! Very considerate and takes his time with every appointment. Very pleasant! His secretaries are hard working and very busy which does make it difficult when booking an appointment, however in my opinion it's worth the hassle and wait!","May 24, 2016",5,3,5,5
Dr. Keith Bovell,This physician has the attitude of a piece of dirt i would not take a dead animal to him for disposal and that is the truth he should not hold a valid Parisians licence he is racist toilet bed Sid e man .how in our health care system let a careless ignorant animal practice to look after a loved one,"Submitted January 21, 2016",1,1,1,1
Dr. Keith Bovell,I am so glad that Dr Bovell is looking after me. Very knowledgeable and caring. Even personally called me after surgery to see how I was doing. Staff is very nice (although they are terrible busy!). Was on waiting list for other specialists in the area for over 2 1/2 years where Dr. Bovell took a look at my case and I had an appointment with in 2 months. So glad I am within his care.,"October 27, 2015",5,5,5,5
Dr. Keith Bovell,At the top of his field. Compassion with a dose of reality. Only the very best to say about Gail as well. She really empathises with patients and works her tush off.,"November 19, 2014",5,5,5,5
Dr. Keith Bovell,"I do not understand why this person is still practicing medicine! It is virtually impossible to get a hold of him for an appointment and even when he sees you,he is completely useless to help unless you have a common problem.","May 27, 2014",1,4,1,1
Dr. Keith Bovell,"Great doctor and staff. The epitome of quality and caring. While historically for my appointments, he often runs late, but I do not attribute this to overbooking or anything negative. I believe it due to his thoroughness and compassion to address each and every patient's concern's and questions. He and his staff of one Gail (who's really more like a staff of 3) helped me through the most difficult period of my life, and as an at-the-time early thirties new father, I am forever grateful. If you are referred here, you are lucky. If not, ask to be.","March 25, 2013",5,4,5,5
Dr. Keith Bovell,Did not have a good experience with this doctor when I was referred to him. Had to go elsewhere for help.,"July 29, 2012",3,2,1,1
Dr. Keith Bovell,Excellent Doctor. He knows his stuff and is always friendly and he puts you at ease. I feel confident in everything he says and does. Unfortunately it takes a while to get an appointment but I know that is not his fault. We need more specialist like him.,"June 27, 2012",5,4,5,5
Dr. Keith Bovell,Dr.Bovell is an amazing doctor who is devoted to his field and loves people! He loves what he does and both him and his wife are an extremely valuable asset to the Guelph community! We love him and are thankful to have him as our doctor:) Dr. B you are a blessing!!!,"February 19, 2012",5,4,5,5
Dr. Keith Bovell,"If the patient takes the time to notify the office by leaving a message that they would like to cancel and reschedule their appointment, it's unacceptable that the office will never call you back to reschedule. This office places the onus on you the patient to call them several times before you can get through, in order to reschedule your appointment. I find this frustrating, time consuming and very customer unfriendly.","January 25, 2012",1,3,4,5
Dr. Keith Bovell,"Dr.Bovell is an excellent doctor. Who honestly complains about having to wait in a waiting room to see him? Isn't that how it is no matter where you go? Consider the time he spends explaining things with you. Would you want him to cut your appointment short or not answer your question because it may make the next person wait an extra 10 minutes? The care is well worth having to wait, and the receptionist is very kind and makes things as simple as possible for the patients. Couldn't have asked for a more excellent doctor.","December 9, 2011",5,4,5,5
