physName,comment,commentDate,ratingStaff,ratingPunctuality,ratingHelpfulness,ratingKnowledge
Dr. Rupert Abdalian,"Recently had a colonoscopy and I can't believe I'm saying this, but it was fantastic. Well, not the actual colonoscopy, I slept through that :) 
The entire procedure was fantastic....seamless, the staff were relaxed, yet professional and caring. They made lots of eye contact and small talk as they prepared. I can't believe how relaxed I was. Dr. Abdalian took the time to sit and talk to me and actually had important notes on my medical history that we discussed. He listened, took his time and in no way was any part of the experience rushed. He was thorough and a pleasure to talk to. Yup, thats right...this doctor is someone you actually want to communicate with. The anesthesiologist was a beautiful Serbian woman who quickly put me at ease. Her IV skills were amazing...barely felt the needle. I went into the procedure calm and woke up the same. He sat with me and took his time afterwards to discuss the results and even had some pictures of my insides. Overall, the experience was positive and the staff were top notch. Could not have asked for a more relaxed and fast experience.","February 14, 2016",5,5,5,5
Dr. Rupert Abdalian,"Dr. Abdalian is excellent. His bedside manners, his patience, his knowledge of the subject matter and his skills as a surgeon are all very, very commendable and very reassuring to me as a patient lying on the table in his capable hands. Thanks Doc !","February 9, 2016",4,5,5,5
Dr. Rupert Abdalian,"I was very impressed when I came out of the gastro scan with a diagnosis, medication and all options. I didn't have to come in for more tests. All was done by phone. Easy, quick and excellent.","December 11, 2015",5,5,5,5
Dr. Rupert Abdalian,"You have no idea how hard is to reach Dr. Abdalian. His secretary is sooo bad-Never returns calls, never answers the phone and is almost always late for work. I do not understand why is she not fired yet. DR ABDALIAN if you are reading this - please make something.","Submitted November 18, 2015",1,1,4,5
Dr. Rupert Abdalian,"Dr. Abdalien is super, but his secretary is the most unproffesional office assistant in the Ontario health system. Please doc, fire that girl. She isruining your reputation.","Submitted November 16, 2015",1,3,5,5
Dr. Rupert Abdalian,"I was referred to doctor Abdalian by my previous GI Doctor for a colonoscopy. His staff was very kind and helpful. When coming in to NYGH his staff and nurses were very nice and went out of their way to make me comfortable. Before the procedure he took his time explaining and tending to any questions I had. He never rushed once. He also said he would do a repeat endoscopy and did his best to make me feel comfortable. Before being put under anesthesia him and his staff used humour and small talk to get me to relax along with piano music. This doctor has amazing bed side manners, gave me and my family 20 minutes to explain and answer our questions. Dr abdalian is one of the best GI doctors. He gave me hope after struggling with my problem for a whole year and being ping ponged between doctors before being referred to him. I recommend this doctor to anyone suffering from GI issues and not finding a cure, he did wonders for me. Thank you dr abdalian!","October 7, 2015",5,5,5,5
Dr. Rupert Abdalian,Has an ego and isn't helpful. Maybe he helped some people but not me.,"Submitted September 6, 2015",1,1,1,1
Dr. Rupert Abdalian,"Firstly thanks to Matilda I got timely consult and procedure appointments. Dr. Abdalian has been wonderful so far both in consult, in colonoscopy and post colonoscopy chat. He is so super knowledgeable and current in the GI world (and nice too!). Based on my colonoscopy results I know that I will need to be followed long term by a GI. I am super grateful to have landed in his practice as I feel I will get the best care here possible. Highly, highly recommend!","September 3, 2015",5,5,5,5
Dr. Rupert Abdalian,"Dr Rupert Abdalian is absolute exception from what most of us are unfortunately encountering while seeking medical advice. I had this wonderful opportunity today to be with him and his friendliest team for Gastro- and colono-scopies. This doctor is not just knowledgeable but also so caring, so attentive to each and very detail and does take his precious time to communicate with you before and after the procedure. I consider myself fortunate having met him. THANK you, dear DOCTOR! Inara F.","August 11, 2015",5,4,5,5
Dr. Rupert Abdalian,"Dr. Rupert Abdalian is a great Gastroenterologist! He is very knowledgeable, courteous and kind. He is always prepared and takes the time to answer any questions or concerns you may have. He is always current on treatments and innovations in the industry. The only downfall of his practice is his secretary! She must be related to him or he is doing her a serious favour keeping her employed as she is absolutely HORRIBLE! As you can see from previous reviews she never answers phone calls, forgets to send referrals to other doctors, never provides you with test dates ahead of time (hospital called me the night before to remind me of test, fasting was required which I almost did not do if they had not called me) and one can never book an appoinment ahead of time. she is always late in answering your calls and is rude! When you call to inquire then she says ""oh I was just about to call you!"" Very sad that such an amazing doctor would align himself with such a cold hearted and unprofessional person. If you do read your reviews Dr. Abdalian, please address your secretary issues for the better of your patients. As a doctor you are 5 stars but your staff is a zero!","June 21, 2015",1,3,5,5
Dr. Rupert Abdalian,Dr Rupert Abdalian is really the best doctor I have ever seen in my whole life.He is the most knowledgeable gastroentrologist in the world.And also has the best personality you can ever imagine for a human.His commnication skills is so great.Anybody who may have this Dr as his/her gastroentrologist will be the luckiest person.Thanks God people such as Dr Abdalian still exist!!!,"January 5, 2015",5,5,5,5
Dr. Rupert Abdalian,"Once you get face-to-face with Dr. Abdalian, he is knowledgeable, respectful and caring. However, he and his receptionist are almost impossible to reach for questions, appointments bookings or prescription refills. 6 months after starting a new biologic medication, I initiated a request for a follow-up appointment . 2 weeks after leaving a phone message, I received, via snail mail from my FP, a copy of an appointment notification with Dr. A one month hence. Not a good way to run a practice, in this century.","November 7, 2014",2,2,4,5
Dr. Rupert Abdalian,"an hour late in seeing me, and his secretary never answers phone calls, forgets to send referals to other doctors and one can never book an appoinment ahead of time. she is always late in answering your calls and is rude, I would never go there again.","November 5, 2014",1,1,1,4
Dr. Rupert Abdalian,"Dr. Abdalian is one of the emerging great minds in Toronto gastroenterology. I had the honour of being part of his practice for 2 years (before I relocated). While young, he speaks with the knowledge of someone practicing for decades. He's very familiar with conditions and treatment plans but I'm most impressed with his knowledge of emerging trends and treatments. Clearly a very well-read professional. He has great bedside manner, takes the time to explain complex topics in an understandable way for his patients and shows a genuine level of caring unlike anything I've experienced elsewhere in my medical history. Wait times are minimal (15 minutes to an hour, max) compared to hospital GE clinics (30 minutes to 3 hours... I've been a patient of both). Front desk is very polite, courteous, quickly knows patients on first-name basis and is multi-lingual. By far the best gastroenterology care I've received in my lifetime. Highly recommended to all.","June 9, 2014",5,4,5,5
Dr. Rupert Abdalian,"I went with my daughter to doctor Abdalian with some GI problems. In the past we have had several others GI specialists. The first time we visited him we were so impressed. We feel privillaged to have him as our doctor. He is truly a blessing from God. He is extremely compassionate, caring, and taking time to listen to the patient and the patients family. He even calls home informing if there's any changes in the blood work or any other reports . Surgery is always his last option. The staff are well as great. They were very responsible and punctual when it comes to communicating the messages to the doctor. All messages were responded within 24 hours. We pray for Dr Abdalian every day. Let god use you more in the future for patients like us. Great great doctor. You are really serving the community and the people. God bless you","May 5, 2014",5,5,5,5
Dr. Rupert Abdalian,"Dr. Rupert Abdalian is the most caring, compassionate specialist I have yet to encounter. I have seen him on three occasions in the past four months & each time he spoke to me about what he was about to do in depth & listened to my symptoms intently. He phoned me at home with my diagnosis & phoned in my meds etc promptly. Anyone who is lucky to be his patient will be so pleased to have him as their doctor!! So happy to have someone diagnose the awful problem I have had to suffer for more than 2 years & treat me compassionately. You are the best in Toronto.","April 29, 2014",5,5,5,5
Dr. Rupert Abdalian,"I have seen Dr. Abdalian twice in the past year and have been very satisfied with him. He is knowledgeable and takes the time to consider everything you tell him and to look at your problems from many different angles. He is very patient and compassionate. Dr. Abdalian, you are definitely in the right field! - Linda B.","February 7, 2014",5,4,5,5
Dr. Rupert Abdalian,"Secretary never answers phone calls, forgets to send referals to other doctors and one can never book an appoinment ahead of time, you will have to wait for secretary to call you..and she never will...one week prior to your desire appoinment and you will get it for a month later","December 2, 2013",1,4,5,5
Dr. Rupert Abdalian,"Dr.Abdalian is by far the best GI specialist in Toronto. His level of knowledge, skill and compassion is unmatched. Two of my family members have seen him and were extremely satisfied with him. God Bless this doctor :)","July 10, 2013",5,5,5,5
Dr. Rupert Abdalian,"He is a wonderful doctor,other than his high level of knowledge ,he has a great character.He is very very kind and supportive.I have never seen such a doctor before.God Bless him!I always pray for him,his family and all his patients.","June 12, 2013",5,5,5,5
Dr. Rupert Abdalian,"He is by far the best doctor in the GTA. He listens, is patient and is incredibly kind and compassionate. This is not something you see very often in the medical field & is truly a blessing. I had been to see several specialist before him and was not only treated incorrectly medically but never properly diagnosed. Within the first 6 months Dr Abdalian diagnosed me correctly & I have been on the path to healing. I have had a couple of ""bumps"" in the road recently with my ulcers bleeding again as well as gallbladder issues but he has once again stepped in to make sure that I am receiving the proper care. His staff members have also been really lovely and supportive. Dr Abdalian does not over medicate and always looks for alternative solutions before considering surgery. I highly recommend him.","May 29, 2013",5,5,5,5
Dr. Kenneth Malhotra,"I have been fortunate enough to have Dr. Malhotra. The nurses and receptionists and his clinic are fantastic. It is a busy office but you never feel you are being rushed out the door. they take your concerns to heart and appear to be quite thorough. He will always answer your questions, and you can be confident that he reviews all your test results thoroughly. He honestly seems to care.","November 28, 2016",5,5,5,5
Dr. Kenneth Malhotra,EXCELLENT DOCTOR. KNOWLEDGEABLE PUNCTUAL AND GREAT BEDSIDE MANNER.,"Submitted October 7, 2015",5,5,5,5
Dr. Kenneth Malhotra,"I agree with the postive comments: thorough, caring, reassuring. Doesn't hurt that he is so dang good-looking!!! I'm glad nothing is wrong w/me but sad our visit will end soon.","July 14, 2014",4,4,5,4
Dr. Kenneth Malhotra,Dr. Malhotra is approachable and easy to talk with. He's shown himself to be thorough in his assessments and quite capable.,"June 6, 2013",5,5,5,5
Dr. Kenneth Malhotra,"Dr. Malhotra is amazing. I've seen him a few times for different issues and he is thorough, caring and extremely approachable. He takes time to answer every question and really listens to his patients. He was determined to find out exactly what was causing my pain and has done everything humanly possible to help me. I would recommend him to everyone (and I do).","March 26, 2013",5,5,5,5
Dr. Kenneth Malhotra,"Dr. Malhotra is an exceptional GI. He takes his time to answer all questions you may have and makes sure you fully understand before ending the apt. He is kind, and an excellent listener. He tries to minimize medication intake if possible and takes your wellbeing very seriously. I would highly recommend him as the top GI in the area and I thank him for all of his help with my specific GI issues. Fantastic.","October 26, 2012",3,5,5,5
Dr. Kenneth Malhotra,"Very understand of my fear of needles, Made me feel at ease","September 8, 2012",5,5,5,5
Dr. Kenneth Malhotra,"Dr. Malhotra is always smiling, friendly and easy to talk to. I feel that he really cares about his patients and treats his staff wonderfully. I always look forward to seeing him and would recommend him to family and friends.","July 19, 2011",5,5,5,5
Dr. Kenneth Malhotra,Excellent both with pt and with staff great bedside manner and is on time well liked by hosp staff knowledge is not limited to his specialty,"November 17, 2010",5,5,5,5
Dr. Lyle Bissonnette,"Excellent doctor. He is very intelligent and understanding in his field of medicine. Easy to talk with, he makes an appointment with him very productive. He was compassionate in helping me through a serious illness and continues to treat me well; I am confident that he is taking the best approach in continuing my well-being. He's a very busy man, so it can be difficult to see him outside of regular scheduled appointments. I would recommend him to anyone.","September 8, 2017",5,4,5,5
Dr. Lyle Bissonnette,Will genuinely listen to your concerns and always appreciates your input for decision making. I'm currently in a flare and told him that prednisone is off the table to me due to the horrible side effects from the first time and he never pushed me to change my mind. In the past the secretary was an issue but since hiring a new person I feel like they have really stepped their game up. Really appreciate him as a doctor!,"June 15, 2017",5,4,5,5
Dr. Lyle Bissonnette,Dr. Bissonnette is the best gi doctor ever he has done so much for me and still does. I can't appreciate how much he has done for me. Your the best Dr. Bissonnette!,"May 28, 2017",5,5,5,5
Dr. Lyle Bissonnette,Amazing doctor but worst assistant I have ever seen in my life,"March 15, 2017",1,1,1,5
Dr. Lyle Bissonnette,"Simply the best!He has placed gastroenterology on the next level, very knowledgeable, helpful and has great interaction with his patients. He is explaining in detail what is yor illness about and what he will do to help to get you better and he really does his best in order to improve heslth of his patients. Thank you dr Bissonnette!","March 5, 2017",5,5,5,5
Dr. Lyle Bissonnette,DR Bissonnette is amazing and very helpful. however if he wants his patients happy and not ruin his reputation he need to get a new secretary. several times it take her assistant almost 2 weeks to get back to us and she is very rude.,"February 23, 2017",1,4,5,5
Dr. Lyle Bissonnette,I am a young guy and they all made me feel comfortable and were very helpful. 100% recommend,"January 10, 2017",5,5,5,5
Dr. Lyle Bissonnette,Dr bissonette and his staff are awesome . I am so thankful i have him as my crohns doctor,"February 29, 2016",5,5,4,5
Dr. Lyle Bissonnette,highly recommended took time to explain everything,"February 1, 2016",5,5,5,5
Dr. Lyle Bissonnette,I found him extremely helpful and patient. I did not feel rushed and he answered all my questions and made some wonderful suggestions. An excellent doctor!,"November 26, 2015",5,5,5,5
Dr. Nadeem Hussain,Dr. Hussain is a very caring and knowledgeable specialist. He is very skilled and would recommend him to anyone. The nurses that work in gastrointestinal/endoscopy unit at St Joe's are really amazing and make you feel very comfortable.,"June 7, 2017",4,4,5,5
Dr. Nadeem Hussain,"Kind of a mediocre experience. The wait time to see him is long but I suppose it's worth it. He is thorough, more so than his resident who was awfully dismissive of my symptoms. He's not personable but he's knowledgeable and that's more important. My only complaint is that there are issues with how the clinic functions. The staff are very good people, but there appears to be some kind of issue with appointments and checking in. The doctor accused me of missing an appointment in the past that I swore up and down had not been the case. I went home to learn that the day in question was the endoscopy which I had attended - but he hadn't! Maybe he was remembering it wrong? I'm not sure if someone made a mistake when checking me in but I had been there and he was holding the test results from that day in his hands. I'm glad he didn't charge me for ""missing"" it but it all seemed so ridiculous. That would be the second time I wasn't fully checked into the system, another time, after registering at the desk, I waited three hours past my appointment only to find out that I was never actually checked in. I did get to see him eventually. This could be a technical error but I hope they fix it so appointments run more smoothly in the future.","April 25, 2017",3,3,5,5
Dr. Nadeem Hussain,"Very rude and belittling about my weight, seemed not to want to be bothered with me because I am over weight. I know I need to loose a bit of weight, but don't be rude and condescending because you think I should loose it faster.","January 10, 2017",5,3,2,5
Dr. Nadeem Hussain,"Dr. Hussain treated my daughter (diabetic) who had been experiencing pain, nausea, hospitalization for more than 3 years. Prior to seeing him she had been through the whole gamut of tests and prescribed more pills than a young woman under 20 should need to take. Dr. Hussain offered suggestions on diet changes, ran the tests and went over every result with us. BEST DOCTOR EVER! Thank you so much for everything you have done for her","November 29, 2016",5,5,5,5
Dr. Nadeem Hussain,"Dr. Hussain is kind, thorough, knowledgeable and the most compassionate doctor I've ever been to. Highly recommended, you can't go wrong with him.","November 9, 2016",5,5,5,5
Dr. Nadeem Hussain,"Worst doctor I've ever delt with. Very belittling and dud not do test I was originally sent for. .left with the comment ""you'll have to live with it I don't know what it is"" maybe it's all in your head even tho i have lumps moving around abd pushing out causing extreme pain!! I'm disgusted!!","October 18, 2016",3,2,1,3
Dr. Nadeem Hussain,"I am a very nervous person when it comes to getting anything done, he was very calm and nice and took the time to calm me down. I was out for my procedures and when I woke up no pain or discomfort at all. I would suggest him to all my friends and family. He is very busy but Sarah always made time and made appointments work for me as well as him.","September 13, 2016",5,4,5,5
Dr. Nadeem Hussain,Dr Hussain did a procedure on my mother. He did one awsome job...mom said ...he was very friendly and funny. She felt zero pain. I met with him also ...he was very nice and very informative to mom's procedure and after care. Love this doctor! !,"July 20, 2016",3,5,5,5
Dr. Nadeem Hussain,He's a great Dr. to deal with. Very helpful and informative.,"July 8, 2016",5,5,5,5
Dr. Nadeem Hussain,"I saw Dr Hussain on Tuesday March 29, 2016, and I could not have met a more kind and compassionate Doctor. I have been through a very traumatic life changing event in the past 6 months, and Dr. Hussain could not have been more caring or sincere about my personal tragedy. In regards to my health, and the reason I was referred to him that day, he was highly professional, he answered all of my questions and was incredibly reassuring. I am so fortunate that my surgeon referred me to this wonderful man and I know my health is in excellent hands with him and his staff. I work in the health care field and deal with Doctors and specialists every day, and I would highly recommend him to anyone!! S.L.","March 31, 2016",5,5,5,5
Dr. Nadeem Hussain,"This so called doctor is mean and cruel and makes you feel very uncomfortable, If he doesn't understand or you ask questions he storms out of the room like a child not getting his way. Very unprofessional and I would not recommend him to anyone! I spend days in hospital because of his wrong doing, If anything his made my pain worst.","Submitted March 1, 2016",4,2,1,1
Dr. Nadeem Hussain,"I saw Dr. Hussain for my first intake appointment a bit ago. I am a very nervous person when it comes to any doctor appointments. A colonoscopy is not something that I look forward to but Dr. Hussain is a very compassionate man. He listened to all my concerns, he took the time to ask about my family history, he explained the procedure in full detail, he explained the differences with the types of anesthetic I could have, he explained the differences between the medication that I can take, he did not rush, he was not rude, he was patient, he was very thorough in his assessment. I feel very confident in his ability as a specialist and he definitely calmed my anxieties. I would highly recommend him.","February 25, 2016",5,5,5,5
Dr. Nadeem Hussain,"I found Dr. Hussain to be very professional and easy to talk to. I have a very large polyp that needed to be removed so when it came time to be put out the person was unavailable due to emergency-no fault of Dr. Hussain. We went ahead with the procedure, it was very uncomfortable and I will not have another scope done without have anesthetic. 
Sarah is a joy and went out of her way to make arrangements work for me. I really appreciate that. Overall I am pleased with Dr. Hussain and his staff and would highly recommend them to anyone.-K","September 1, 2015",5,5,5,5
Dr. Nadeem Hussain,Dr. Hussain was the first doctor in 32 years to solved a major health issue of mine that many other doctors were unable to figure out (and he knew what the issue was during my first visit). I feel like this man gave me my life back that I never had. I'm very grateful for the referral that I was given to him.,"January 20, 2015",5,5,5,5
Dr. Nadeem Hussain,"I've seen multiple Gastroenterologist and I can say with honesty that Dr. Hussain was the most warm, gentle and amazing MD that I have ever seen. His bedside manner is fantastic. He takes time to listen and is very knowledgeable. I would recommend him hands down to anyone!","December 31, 2014",5,5,5,5
Dr. Nadeem Hussain,I saw Dr. Hussain for an upper scope and it was not only my first procedure but my first time being put under anesthetic so I was generally uncomfortable and nervous but he assured me everything was going to be okay and it was. He is very good at his job however his bedside manner could use improvement. For my follow up visit he was pushy and even started to raise his voice at me for no great reason. I felt like because i wasnt on his operating table making him a lot of money i wasnt worth his time. His receptionist Sarah is amazing.,"December 2, 2014",5,5,3,5
Dr. Nadeem Hussain,"I had my first visit with Dr Hussain today and am beyond pleased. I am so relieved to have found someone so knowledgeable, kind and easy to talk to about uncomfortable issues. He was so sweet and kind. Gabe me hope and look forward to seeing him again.. And feel assured for the first time in minths a sokution to my oroblems will be reached and i am in good hands. Which is saying a lot when it comes to doctors! Cute too, endearing smile and demeanor.","April 15, 2014",5,5,5,5
Dr. Nadeem Hussain,"young female,regarding colonoscopy: rushed me out of 1st visit, not very personable or helpful. I woke up DURING procedure, and making noise because I could feel what they were doing! I remember him acting like it was nothing. Afterwards, he left the building before I woke up and could talk to him, which apparently astonished the nurses who were in charge of post-procedure patients. When I went for my follow up, I saw a med student who wasn't very confident, and when he went to check if dr hussain would see me, he said he was too busy and would not. I hope he gets fired to be honest, horrible blemish on our healthcare system which could use some intense overhaul anyway. I'd recommend asking for someone else.","January 20, 2014",1,1,1,1
Dr. Nadeem Hussain,"I have been with Dr Hussain for 10 years. He has always been kind, engaging, helpful. I would recommend Dr Hussain to my family and friends for his knowledge, bedside manner and care. As far as staffing, Sarah has been excellent however the nursing staff can be moody.","December 17, 2013",4,4,5,5
