physName,comment,commentDate,ratingStaff,ratingPunctuality,ratingHelpfulness,ratingKnowledge
Dr. Nabil Malak,"I have been dealing with the Qc healthcare system since 2011, being treated like a number, feeling like my life didn't mater and I felt worthless until I was referred to Dr Malak in the Fall 2015. He was my savior in so many ways. He really made me feel like he cared and that I mattered. He made me feel like I was worth his time and effort. I had my surgery in May 2016 and I was overwhelmed with the way I was treated by the staff in the surgery room. It almost felt like I was at a spa, music in my ears, heated cover, leg massager, etc... Dr. Malak was the best surgeon I have ever had. He not only took care of my physical health, he also took great care of my mental health without really knowing he was. The way he treated his patient had a great impact on their recovery. I was very saddened this week when I heard that he had passed. I will really miss him. My sincere condolences to his family, colleagues and to his patients as well. Shukraan xx","July 6, 2017",5,5,5,5
Dr. Nabil Malak,R.I.P HE WAS THE BEST DOCTOR I'VED KNOWN I MISSED HIM ALOT 🙏,"June 30, 2017",5,5,5,5
Dr. Nabil Malak,"He successfully operated my husband, he was so kind, so patient, an angel, he will be missed, thank you dear DR Malak xox","June 21, 2017",5,5,5,5
Dr. Nabil Malak,I will miss you doctor thy for all the operation you did for me. R i. P.,"June 15, 2017",5,5,5,5
Dr. Nabil Malak,"The best surgeon and Doctor they had at HGH. He will be dearly missed by staff and so many patients. RIP, you deserve the rest, you did so much good to all.","June 14, 2017",5,5,5,5
Dr. Nabil Malak,"Amazing doctor, patient, gentle, devoted to his patients. Wonderful person.","June 14, 2017",5,5,5,5
Dr. Nabil Malak,"Dr malak has soooo much patience, is soft spoken and will take time to listen to everything you have to say. I felt at ease with him, he was always smiling and positive. I recommend this doctor to anyone who is stressed out about having anything from colonoscopies to surgeries. He is absolutely wonderful!","May 17, 2017",5,5,5,5
Dr. Nabil Malak,"We are so fortunate to have Dr. Malak taking care of my mother. We just had a consultation with him. He was so understanding and kind my instinct was to give him a hug as we were leaving.....I wish he could be my all the time Dr. My Mum also thought he was wonderful! What a lovely gentleman. The appointment started off very well with Karen taking down all Mum's information and getting her set up with her appointment. What a great team they make. Thank you Karen, thank you Dr. Malak","October 16, 2015",5,5,5,5
Dr. Nabil Malak,"Very nice and good doctor, did a hemmorroids surgery that healed very well! thanks","April 16, 2015",5,5,5,5
Dr. Nabil Malak,"I have had surgery done twice by Dr Malak and found him to be knowledgeable, kind and thoughtful, and very competent. If I ever need surgery again I would definitely want him to do it!","January 12, 2015",5,3,5,5
Dr. Nabil Malak,"Only one thing can describe, the best surgeon and the man most human ... Benoit Sirois Thurso Qc","February 21, 2013",5,5,5,5
Dr. Phil Inouye,"I must say among all physians whom I have dealt with, Dr Inouye is the best in all aspects. Not only does he listen to you attentatively but also patiently answer every single question you ask. Some physians may be very politie, but you don't get the ""genuine"" feelings from them. Brenda, the secretary, is also extremely helpful. I completely got the nasty gastrorelux under control by Dr Inouye. Thank you Dr Inouye!","August 9, 2017",1,1,1,1
Dr. Phil Inouye,Very knowledgeable and helpful. I feel like he truly cares about me as a patient. Brenda at reception is wonderful too.,"July 12, 2017",5,5,5,5
Dr. Phil Inouye,"I have had him as my Doctor for over 8 years now and he pretty much saved my life at the beginning of it all. During my diagnosis he answered every single one of mine and my families questions (even the stupid ones) and he never once made me feel dumb or unintelligent. He explained everything in great detail (scientifically and basically) on many occasions and has extremely good bed side manner. I felt like I was in very good hands during the whole process, and I still do to this day! He takes his time with me, making me feel like he cares about my well being. I don't think i have anything bad to say about him. Thank you Dr. Inouye!","March 30, 2017",5,5,5,5
Dr. Phil Inouye,"Not personable, actually quite skittish. I had to fire him. Too bad... He had such good ratings.","February 23, 2017",5,5,2,4
Dr. Phil Inouye,"This doctor is highly regarded in the community and received all kind of praises on this website. My overall experience is very different - I saw very little care from him and his staff, which is not surprising considering his practice, is run as a very shrewd business. 
After waiting for over 2 years after my doctor’s referral, I got my first rendezvous with him. He was attentive while making promises to resolve my situation with long-term abdominal pain. He booked me for colonoscopy even though my last one was fairly recent. 
After colonoscopy and also endoscopy his attitude changed drastically he was no longer caring and practically became dismissive. He was not able to provide me with diagnosis; not exactly gently hinting that I need to loose weight (I am very far from being fat) as well as pushing the pills that I clearly indicated to him were not working for me. He just did not care!
Even though after all expensive tests our last conversation did not provide me with any clues into my condition nor offered me any helpful tips how to manage the pain, I was still hoping that I can at least see him if things get worse. No such luck – his door is even more firmly shut than before: no more new referrals for anyone and his existing patients need to go through family doctor first and provide him with paperwork before he considers to see them again. I had been “fortunate” to see him in his office 2 times and was the only person in his waiting room – there was nobody else waiting for the appointment (this is with the waiting time of more than 2 years). My conclusion is very simple – this doctor is only interested in being paid for expensive procedures (tests, surgeries). He feels no obligation to check on his patients’ condition and will damp you as soon as all tests are done, especially if no expensive surgeries are needed. Considering the lack of specialists in the area, his “business” will continue to thrive while his not so profitable patients continue to suffer.","January 5, 2017",1,1,1,1
Dr. Phil Inouye,"I wish I would have got this doctor for my colonoscopy had no problem 5 years ago but I end up getting a real quack this time and I'm still suffering,","November 1, 2016",4,4,4,4
Dr. Phil Inouye,"I really lucked out with Dr. Inouye! He was the treating physician in the ER for me about 5 years ago and immediately put me at ease (and made the nurse give me the right amount of painkiller!) I'd had a couple of colonoscopies that didn't exactly leave me jazzed (one of them was with a doctor that made the news...and not in a good way). He knocked me out and when I woke up, it was all over, no residual pain, no bleeding, nothing at all. He admitted me to the hospital and I was nervous about taking steroids to get my UC under control but he took the time to explain everything and reassure me that I wouldn't suffer any long-term effects. He kept me as a patient and I've seen him a couple of times a year since then. Very kind, very knowledgeable, polite, really listens to you...and not hard to look at (that's just a bonus) and his staff are just treasures! Very accommodating, professional but warm and friendly.","May 2, 2016",5,5,5,5
Dr. Phil Inouye,"I am so grateful for this caring and expert gastroenterologist. I have never felt better. I knew I was in good hands when I went in for my first colonoscopy and the surgical nurse at QCH whispered to me ""He is the best... you have nothing to worry about"". His nurse/receptionist is lovely and kind too.","February 9, 2016",5,5,5,5
Dr. Phil Inouye,Best doctor for gluten issues or gastric issues. Always professional and on time.,"February 2, 2016",5,5,5,5
Dr. Phil Inouye,"In April 2015 I had a bleeding artery. I lost 2 liters of blood in the emergency room and fell unconscious before Dr Inouye was called in. He saved my life! His amazing skills stopped the bleeding, repaired the rupture, infused me with fluids, and I was discharged in 10 days. The nurses at the General and the QCH were the best. The ER at QCH not so much. Many thanks to all.","January 6, 2016",5,5,5,5
Dr. Niculina Mariana Margulies,"Can say I enjoyed the procedure, but she was competent and I would recommend her!","July 2, 2017",5,5,5,5
Dr. Niculina Mariana Margulies,"Excellent Doctor! Took the time to explain and review the results, very knowledgeable and well prepared. Exceptional Physician","April 30, 2017",5,4,5,5
Dr. Niculina Mariana Margulies,I was exceptionally fortunate to be referred to Dr. Margulies. She is a very exceptional physician and diagnostician. Dr. Margulies is the Sherlock Holmes of gastroenterology. I would not hesitate to recommend her.,"February 9, 2017",4,4,5,5
Dr. Niculina Mariana Margulies,"Dr. Margulies made my first colonoscopy almost pleasant! She was caring and took the time to explain the procedure and risks, as well as the need for regular screenings (I am high risk due to family history of colon cancer) and she alleviated any of the fears I had. Highly recommended.","January 7, 2017",5,5,5,5
Dr. Niculina Mariana Margulies,"Dr. Margulies is very kind, professional, skilled and knowledgeable. She takes very good care of her patients and takes the time to explain every detail. The staff is also very kind and helpful. Dr Margulies along with the anesthesiologist and the nurse made my colonoscopy experience, excellent. I did not feel any pain or cramps at all. When I woke up after the procedure I was expecting to have some cramps or pain, but I did not feel a thing. Thank you.","December 22, 2016",5,5,5,5
Dr. Niculina Mariana Margulies,"This is the 3rd colonoscopy I've had at UCLBC and the staff, especially the nurses, are so caring and kind. The atmosphere is very professional, yet so calming. This was the first time I had Dr. Margulies and I can't say enough wonderful things about her. I was quite nervous this time around and she took her time and was so thorough in explaining everything, including possible outcomes and what steps she would take. So gentle, as well, which is a huge bonus. Best part was her ensuring me she would continue to see me as a patient, if needed.","April 28, 2016",5,5,5,5
Dr. Niculina Mariana Margulies,She was born to be a doctor. EXCELLENT professional and as a human being,"March 8, 2016",5,5,5,5
Dr. Niculina Mariana Margulies,"There is a reason why Dr. Niculina Mariana Margulies is rated # 1 .She is kind, informative, patient and knowledgeable. Her staff are responsive and compassionate. I would highly recommend her, and her wonderful staff.","December 16, 2015",5,5,5,5
Dr. Niculina Mariana Margulies,"Having put off my scope for years, i was extremely lucky getting the recommendation for Dr. Marguilies. scope was perfect, and her follow up when results were in....were great!!!","November 4, 2015",5,5,5,5
Dr. Niculina Mariana Margulies,Difficult to get through to speak to someone on the telephone. Dr. Margulies is the most gentle person for a colonoscopy. I don't even feel anything when she does it. I really like her and think that she cares.,"October 21, 2015",4,3,5,5
Dr. Niculina Mariana Margulies,Definitely deserves to be named one of the top Toronto GEs.,"August 17, 2015",5,5,5,5
Dr. Niculina Mariana Margulies,"Dr. Margulies is extremely kind and professional. I was really scared about the gastroscopy and the colonoscopy, but I had a very smooth and nice experience having them done by Dr. Margulies. She also explained me everything in detail and I am really grateful to my family doctor that he referred me to her. She is not only very knowledgeable, but her endoscopy skills are amazing. If you need a gastroenterologist, I highly recommend her.","April 9, 2015",5,5,5,5
Dr. Niculina Mariana Margulies,"This doctor is kind, helpful, supportive, and highly knowledgeable in her field. She is highly professional and skilled and I would recommend her to anyone needing a gastroenterologist. Unfortunately, the secretaries are often rude and disrespectful.","April 25, 2014",1,4,5,5
Dr. Niculina Mariana Margulies,"Dr. Niculina M. Margulies is highly competent, dedicated to her patient's welfare and has a positive attitude to her work, which makes gastroenterology visits that much more accomodating. Highly recommend this gifted specialist to any / all requiring a gastroenterology consult. The Upper Canada Bowel Clinic staff are courteous, professional, the premises immaculate and well-kept up, and breed a very accomodating service-orentation during visits: the patient always feels they are #1. Highly recommended.","July 25, 2013",5,5,5,5
Dr. Niculina Mariana Margulies,"Dr. Margulies is extremely professional, kind and caring with her patients. She takes her time to explain the medical procedure so patients are informed about what's going on. I would recommend her to anyone in need for a GI exam. An outstanding MD!","January 2, 2013",5,5,5,5
Dr. Niculina Mariana Margulies,"My mom had a colonoscopy done and everything went smoothly. Dr. Margulies was very nice and explained the procedure and the results. The only negative thing is that the resting area isn't private, but her overall experience was very good.","March 6, 2012",5,4,5,5
Dr. Niculina Mariana Margulies,I echo previous comments and ratings! Great experience. Thank you!!!,"October 24, 2011",5,5,5,5
Dr. Niculina Mariana Margulies,"A Mt. Sinai emergency doctor referred me to the Upper Canada Lower Bowel Clinic after I was admitted for a very low hemoglobin count. Dr. Margulies was shocked that the referring doctor didn't see the urgency of identifying the cause of my problem; i.e. they should have conducted tests while I was at the hospital. Since then, Dr. Margulies has been amazingly dedicated to helping diagnose the cause of my disease. I am very grateful for her commitment to my health. Thank you.","June 18, 2011",5,5,5,5
Dr. Niculina Mariana Margulies,"What a wonderful doctor and person! She acts very professionally and she is very knowledgeable, in addition to which, Dr. Margoulis is the most soft-spoken, encouraging and caring doctor we have ever met. She really cares for her patients! After answering all our questions thoroughly, she even came back to us after the appointment with further advice that she had thought of, just as we were leaving the clinic... Multumim, Dr. Margoulis!","June 9, 2011",5,5,5,5
Dr. Niculina Mariana Margulies,"Fantastic care, kind, knowledgeable and most important, quick to deal with serious diseases, such as colon cancer. Spent extra time to address all questions asked.The medical report was dictated the same day of the visit.","July 24, 2010",5,5,5,5
Dr. Niculina Mariana Margulies,"Very meticulous, skilled, and kind. She came earlier in the morning to expedite my case.","July 15, 2010",5,5,5,5
Dr. Niculina Mariana Margulies,This doctor has patience and a patient focused approach. I felt very comfortable and valued as a patient. All my questions were answered and she addressed all my worries. I have complete trust in her.,"July 15, 2010",5,5,5,5
"Dr. Mohammad Hussein , M.B.Ch.B , FS , MD , FAAP, Consultant Paediatrician & Paediatric Gastroenterologist & Clinical Nutrition",So lucky to have found that really listened to me finally . I am sure my daughter will be in good hand from now on. Thank you Dr. Hussein for every second you have spent listening to my concerns.,"June 25, 2017",5,5,5,5
"Dr. Mohammad Hussein , M.B.Ch.B , FS , MD , FAAP, Consultant Paediatrician & Paediatric Gastroenterologist & Clinical Nutrition","Dr. Hussein where do I start not even a million words can express this doctors kindness and knowledge. He is a blessing from god, unlike other doctors not all but some. Doctor Hussein cares and listens to every concern. Some doctors just call do test and don't care but Dr Hussein is a blessIng this is what I call a real doctor.","April 21, 2017",5,5,5,5
"Dr. Mohammad Hussein , M.B.Ch.B , FS , MD , FAAP, Consultant Paediatrician & Paediatric Gastroenterologist & Clinical Nutrition","My son had a constant fever and coughing went to see walk in clinic doctor she gave him antibiotic but didn't work on him and after a 5 days he stops walking and started crawling then I realized something wrong. I went to another walk in clinic the doctor asked for xray and also refereed to Dr. Hussein, xray came with no sign of any trouble but Dr. Hussein once physically checked my 7 years old said that no your son has a Pneumonia and the pain is captured his bones. I said but the xray came with nothing but he said my experience say something else so he started treatment of Pneumonia and within 2 days my son started running. I would say Dr. Hussein is the best child specialist I have ever met. God bless you. Milton we are lucky that we got Dr. Hussein.","April 18, 2017",4,5,5,5
"Dr. Mohammad Hussein , M.B.Ch.B , FS , MD , FAAP, Consultant Paediatrician & Paediatric Gastroenterologist & Clinical Nutrition","Dr. Hussein is amazing. We are from Oakville to Milton to see him as he is really thoughtful and knowledgeable in his professional field. He truly takes time to listen to our concerns and explain the issues. My two kids are in great hands, especially for my little one, who has progressed a lot with his help. We are lucky to have him as our kids' paediatrician.","March 3, 2017",5,5,5,5
"Dr. Mohammad Hussein , M.B.Ch.B , FS , MD , FAAP, Consultant Paediatrician & Paediatric Gastroenterologist & Clinical Nutrition","I've never had a Dr sit and listen and ask questions like Dr Hussein. Both my son and I felt like he really cared about helping us, not trying just to get us in and out. First appointment he took a full hour with us, to really get a handle on our problem. Called me while he was on vacation to make sure we got the test he ordered. He runs bit behind, but that's because he is really trying to help his patients, not just rush them through.","February 27, 2017",4,4,5,5
"Dr. Mohammad Hussein , M.B.Ch.B , FS , MD , FAAP, Consultant Paediatrician & Paediatric Gastroenterologist & Clinical Nutrition","This is the best Doctor I have ever met.....We come from Hamilton to Milton 
for his knowledge and expertise...he has solved all my sons issues and has a great bedside manner....as well as he takes the time to explain every little detail about the condition he has diagnosed.......Thanks you are special......","February 24, 2017",5,5,5,5
"Dr. Mohammad Hussein , M.B.Ch.B , FS , MD , FAAP, Consultant Paediatrician & Paediatric Gastroenterologist & Clinical Nutrition","My child feels confident when he sees Dr Hussein, we are greatful to have Dr. Hussein as my child's dr. Thank again for all your helph and understanding my child's needs","February 22, 2017",4,5,5,5
"Dr. Mohammad Hussein , M.B.Ch.B , FS , MD , FAAP, Consultant Paediatrician & Paediatric Gastroenterologist & Clinical Nutrition","Dr Hussein is a wonderful doctor. I am grateful to have him as my sons doctor, he really takes the time to explain things and is always willing to help us last minute. He is an overall great doctor and has great bed side manner as well","February 21, 2017",5,5,5,5
"Dr. Mohammad Hussein , M.B.Ch.B , FS , MD , FAAP, Consultant Paediatrician & Paediatric Gastroenterologist & Clinical Nutrition","Dr. Hussein is wonderful! 
Although we only recently started seeing him for my son, we feel so confident that he is in great hands with him. From our first visit with him, he began ordering all necessary tests to ensure he correctly treats our son, and also took the time to explain everything in detail. 
Dr. Hussein takes the time to really listen to the issue and address all our concerns. He does not rush us out of the room but rather is so patient and kind. He truly has a calm ora about him and you know that your child will get the best care while with him.
I have already referred him to many people in hopes that he too can see them because he is that good!","February 21, 2017",5,5,5,5
"Dr. Mohammad Hussein , M.B.Ch.B , FS , MD , FAAP, Consultant Paediatrician & Paediatric Gastroenterologist & Clinical Nutrition",Dr. Hussein is outstanding and you are very lucky if you get the opportunity to have him care for your children. Not only does he have a specialty but he is well versed in the importance of nutrition and is not interested in forcing drugs etc. He spent at least 30 minutes with each of my boys and does not let you leave the appointment until you feel confident that all be will okay. He has moved out of our area and this is quite disappointing for the entire family. I doubt you will find a better Doctor that looks at the full picture of health and is that patient and knowledgeable.,"November 16, 2016",5,4,5,5
"Dr. Mohammad Hussein , M.B.Ch.B , FS , MD , FAAP, Consultant Paediatrician & Paediatric Gastroenterologist & Clinical Nutrition","Dr.Hussein is really a real doctor that cares about you child only and nothing else .Yes, it feels he spends lots of time but you may wait a maximum of 10-20 minutes at most and there are days I just walked in .He is very efficient and focused. He addresses your child as a whole not only the issue that you came in for . He is extremely professional and caring with heart warming approach. My kids love him.","October 9, 2016",5,5,5,5
"Dr. Mohammad Hussein , M.B.Ch.B , FS , MD , FAAP, Consultant Paediatrician & Paediatric Gastroenterologist & Clinical Nutrition","Highly recommend Dr. Hussein.
Smart and kind. My kids love him.","September 20, 2016",5,5,5,5
"Dr. Mohammad Hussein , M.B.Ch.B , FS , MD , FAAP, Consultant Paediatrician & Paediatric Gastroenterologist & Clinical Nutrition","Dr. Mohammad Hussein is an amazing Doctor. He takes his time with his patience making sure they have the best care needed. He treated my son as if he were his son. He's very friendly, approachable, knowledgable and professional. I would definitely recommend Dr. Hussein .","August 28, 2016",5,5,5,5
"Dr. Mohammad Hussein , M.B.Ch.B , FS , MD , FAAP, Consultant Paediatrician & Paediatric Gastroenterologist & Clinical Nutrition","Dr. Hussein exemplifies and portraits the human being, the physician as well as the pediatrician.
Thanks Dr Hussein for being my three kids' pediatrician.","August 28, 2016",5,5,5,5
"Dr. Mohammad Hussein , M.B.Ch.B , FS , MD , FAAP, Consultant Paediatrician & Paediatric Gastroenterologist & Clinical Nutrition",After having a very competent paediatrician retire we were extremely fortunate to have found Dr. Hussein. He is very thorough and never rushes taking the time to develop a rapport with little ones. My three year old son is very comfortable with Dr. Hussein and has taken quite a liking to him. He takes the time to discuss issues and ensure that parents are fully aware and understanding of situations and diagnoses. Really a great paediatrician!,"August 28, 2016",5,5,5,5
"Dr. Mohammad Hussein , M.B.Ch.B , FS , MD , FAAP, Consultant Paediatrician & Paediatric Gastroenterologist & Clinical Nutrition",Had trouble finding a Ped Dr for my son KJ. I happened upon Dr Hussein and he was a Blessing from God. He meticulously explained my son's hospital discharge records to me in layman terms without me having to ask. He was patient and listened closely to my concerns and made me feel at ease with his course of actions. He was very attentive to my son and took his time. I never felt rushed. I love his style and I see why he has others keep coming back. I hope he opens another practice close by but I will travel to see him regardless. Thanks for doing your job with care Dr Hissein.,"August 26, 2016",4,4,5,5
"Dr. Mohammad Hussein , M.B.Ch.B , FS , MD , FAAP, Consultant Paediatrician & Paediatric Gastroenterologist & Clinical Nutrition","Dr. Hussein is excellent. He is knowledgable, thoughtful, and caring. He takes time to listen to us and address our concerns.","August 25, 2016",5,5,5,5
